
         /\      Grafana   /‾‾/  
    /\  /  \     |\  __   /  /   
   /  \/    \    | |/ /  /   ‾‾\ 
  /          \   |   (  |  (‾)  |
 / __________ \  |_|\_\  \_____/ 

     execution: local
        script: test/generate_template-pdf/load_test.js
        output: -

     scenarios: (100.00%) 2 scenarios, 6 max VUs, 1m0s max duration (incl. graceful stop):
              * smoke: 1 looping VUs for 5s (gracefulStop: 30s)
              * load: Up to 5 looping VUs for 20s over 3 stages (gracefulRampDown: 30s, startTime: 10s, gracefulStop: 30s)

time="2026-02-14T19:14:24+05:30" level=info msg="Starting load test against http://localhost:8080" source=console
time="2026-02-14T19:14:24+05:30" level=info msg="Testing endpoint: /api/v1/generate/template-pdf" source=console
time="2026-02-14T19:14:24+05:30" level=info msg="Payload loaded from: random payload" source=console

running (0m01.0s), 1/6 VUs, 0 complete and 0 interrupted iterations
smoke   [  20% ] 1 VUs    1.0s/5s
load  • [   0% ] waiting  09.0s

running (0m02.0s), 1/6 VUs, 1 complete and 0 interrupted iterations
smoke   [  40% ] 1 VUs    2.0s/5s
load  • [   0% ] waiting  08.0s

running (0m03.0s), 1/6 VUs, 2 complete and 0 interrupted iterations
smoke   [  60% ] 1 VUs    3.0s/5s
load  • [   0% ] waiting  07.0s

running (0m04.0s), 1/6 VUs, 3 complete and 0 interrupted iterations
smoke   [  80% ] 1 VUs    4.0s/5s
load  • [   0% ] waiting  06.0s

running (0m05.0s), 1/6 VUs, 4 complete and 0 interrupted iterations
smoke   [ 100% ] 1 VUs    5.0s/5s
load  • [   0% ] waiting  05.0s

running (0m06.0s), 0/6 VUs, 5 complete and 0 interrupted iterations
smoke ✓ [ 100% ] 1 VUs    5s
load  • [   0% ] waiting  04.0s

running (0m07.0s), 0/6 VUs, 5 complete and 0 interrupted iterations
smoke ✓ [ 100% ] 1 VUs    5s
load  • [   0% ] waiting  03.0s

running (0m08.0s), 0/6 VUs, 5 complete and 0 interrupted iterations
smoke ✓ [ 100% ] 1 VUs    5s
load  • [   0% ] waiting  02.0s

running (0m09.0s), 0/6 VUs, 5 complete and 0 interrupted iterations
smoke ✓ [ 100% ] 1 VUs    5s
load  • [   0% ] waiting  01.0s

running (0m10.0s), 0/6 VUs, 5 complete and 0 interrupted iterations
smoke ✓ [ 100% ] 1 VUs    5s
load  • [   0% ] waiting  00.0s

running (0m11.0s), 0/6 VUs, 5 complete and 0 interrupted iterations
smoke ✓ [ 100% ] 1 VUs    5s
load    [   5% ] 0/5 VUs  01.0s/20.0s

running (0m12.0s), 1/6 VUs, 5 complete and 0 interrupted iterations
smoke ✓ [ 100% ] 1 VUs    5s
load    [  10% ] 1/5 VUs  02.0s/20.0s

running (0m13.0s), 2/6 VUs, 6 complete and 0 interrupted iterations
smoke ✓ [ 100% ] 1 VUs    5s
load    [  15% ] 2/5 VUs  03.0s/20.0s

running (0m14.0s), 3/6 VUs, 8 complete and 0 interrupted iterations
smoke ✓ [ 100% ] 1 VUs    5s
load    [  20% ] 3/5 VUs  04.0s/20.0s

running (0m15.0s), 4/6 VUs, 11 complete and 0 interrupted iterations
smoke ✓ [ 100% ] 1 VUs    5s
load    [  25% ] 4/5 VUs  05.0s/20.0s

running (0m16.0s), 5/6 VUs, 15 complete and 0 interrupted iterations
smoke ✓ [ 100% ] 1 VUs    5s
load    [  30% ] 5/5 VUs  06.0s/20.0s

running (0m17.0s), 5/6 VUs, 20 complete and 0 interrupted iterations
smoke ✓ [ 100% ] 1 VUs    5s
load    [  35% ] 5/5 VUs  07.0s/20.0s

running (0m18.0s), 5/6 VUs, 25 complete and 0 interrupted iterations
smoke ✓ [ 100% ] 1 VUs    5s
load    [  40% ] 5/5 VUs  08.0s/20.0s

running (0m19.0s), 5/6 VUs, 30 complete and 0 interrupted iterations
smoke ✓ [ 100% ] 1 VUs    5s
load    [  45% ] 5/5 VUs  09.0s/20.0s

running (0m20.0s), 5/6 VUs, 35 complete and 0 interrupted iterations
smoke ✓ [ 100% ] 1 VUs    5s
load    [  50% ] 5/5 VUs  10.0s/20.0s

running (0m21.0s), 5/6 VUs, 40 complete and 0 interrupted iterations
smoke ✓ [ 100% ] 1 VUs    5s
load    [  55% ] 5/5 VUs  11.0s/20.0s

running (0m22.0s), 5/6 VUs, 45 complete and 0 interrupted iterations
smoke ✓ [ 100% ] 1 VUs    5s
load    [  60% ] 5/5 VUs  12.0s/20.0s

running (0m23.0s), 5/6 VUs, 50 complete and 0 interrupted iterations
smoke ✓ [ 100% ] 1 VUs    5s
load    [  65% ] 5/5 VUs  13.0s/20.0s

running (0m24.0s), 5/6 VUs, 55 complete and 0 interrupted iterations
smoke ✓ [ 100% ] 1 VUs    5s
load    [  70% ] 5/5 VUs  14.0s/20.0s

running (0m25.0s), 5/6 VUs, 60 complete and 0 interrupted iterations
smoke ✓ [ 100% ] 1 VUs    5s
load    [  75% ] 5/5 VUs  15.0s/20.0s

running (0m26.0s), 5/6 VUs, 65 complete and 0 interrupted iterations
smoke ✓ [ 100% ] 1 VUs    5s
load    [  80% ] 5/5 VUs  16.0s/20.0s

running (0m27.0s), 4/6 VUs, 70 complete and 0 interrupted iterations
smoke ✓ [ 100% ] 1 VUs    5s
load    [  85% ] 4/5 VUs  17.0s/20.0s

running (0m28.0s), 3/6 VUs, 74 complete and 0 interrupted iterations
smoke ✓ [ 100% ] 1 VUs    5s
load    [  90% ] 3/5 VUs  18.0s/20.0s

running (0m29.0s), 2/6 VUs, 77 complete and 0 interrupted iterations
smoke ✓ [ 100% ] 1 VUs    5s
load    [  95% ] 2/5 VUs  19.0s/20.0s

running (0m30.0s), 1/6 VUs, 79 complete and 0 interrupted iterations
smoke ✓ [ 100% ] 1 VUs    5s
load    [ 100% ] 1/5 VUs  20.0s/20.0s
time="2026-02-14T19:14:54+05:30" level=info msg="Load test completed. Started at: 2026-02-14T13:44:24.018Z" source=console
time="2026-02-14T19:14:54+05:30" level=info msg="Finished at: 2026-02-14T13:44:54.417Z" source=console


  █ THRESHOLDS 

    errors
    ✓ 'rate<0.1' rate=0.00%

    http_req_duration
    ✓ 'p(95)<5000' p(95)=12.57ms
    ✓ 'p(99)<7000' p(99)=264.45ms

    http_req_failed
    ✓ 'rate<0.1' rate=0.00%


  █ TOTAL RESULTS 

    checks_total.......: 320     10.525097/s
    checks_succeeded...: 100.00% 320 out of 320
    checks_failed......: 0.00%   0 out of 320

    ✓ status is 200
    ✓ response has content
    ✓ response time < 5s
    ✓ content-type is correct

    CUSTOM
    errors.........................: 0.00%  0 out of 80
    pdf_generation_time............: avg=17.8    min=2      med=5      max=268      p(90)=9.1    p(95)=24.15   p(99)=266.42  

    HTTP
    http_req_duration..............: avg=17.23ms min=2.17ms med=4.24ms max=265.93ms p(90)=8.84ms p(95)=12.57ms p(99)=264.45ms
      { expected_response:true }...: avg=17.23ms min=2.17ms med=4.24ms max=265.93ms p(90)=8.84ms p(95)=12.57ms p(99)=264.45ms
    http_req_failed................: 0.00%  0 out of 81
    http_reqs......................: 81     2.664165/s

    EXECUTION
    iteration_duration.............: avg=1.02s   min=1s     med=1s     max=1.32s    p(90)=1.01s  p(95)=1.02s   p(99)=1.32s   
    iterations.....................: 80     2.631274/s
    vus............................: 1      min=0       max=5
    vus_max........................: 6      min=6       max=6

    NETWORK
    data_received..................: 13 MB  430 kB/s
    data_sent......................: 5.4 MB 177 kB/s




running (0m30.4s), 0/6 VUs, 80 complete and 0 interrupted iterations
smoke ✓ [ 100% ] 1 VUs    5s
load  ✓ [ 100% ] 0/5 VUs  20s
