
         /\      Grafana   /‾‾/  
    /\  /  \     |\  __   /  /   
   /  \/    \    | |/ /  /   ‾‾\ 
  /          \   |   (  |  (‾)  |
 / __________ \  |_|\_\  \_____/ 

     execution: local
        script: test/generate_template-pdf/spike_test.js
        output: -

     scenarios: (100.00%) 1 scenario, 100 max VUs, 2m10s max duration (incl. graceful stop):
              * spike: Up to 100 looping VUs for 1m40s over 7 stages (gracefulRampDown: 30s, gracefulStop: 30s)


running (0m01.0s), 000/100 VUs, 0 complete and 0 interrupted iterations
spike   [   1% ] 000/100 VUs  0m01.0s/1m40.0s

running (0m02.0s), 000/100 VUs, 0 complete and 0 interrupted iterations
spike   [   2% ] 000/100 VUs  0m02.0s/1m40.0s

running (0m03.0s), 001/100 VUs, 1 complete and 0 interrupted iterations
spike   [   3% ] 001/100 VUs  0m03.0s/1m40.0s

running (0m04.0s), 001/100 VUs, 3 complete and 0 interrupted iterations
spike   [   4% ] 001/100 VUs  0m04.0s/1m40.0s

running (0m05.0s), 002/100 VUs, 6 complete and 0 interrupted iterations
spike   [   5% ] 002/100 VUs  0m05.0s/1m40.0s

running (0m06.0s), 002/100 VUs, 10 complete and 0 interrupted iterations
spike   [   6% ] 002/100 VUs  0m06.0s/1m40.0s

running (0m07.0s), 003/100 VUs, 15 complete and 0 interrupted iterations
spike   [   7% ] 003/100 VUs  0m07.0s/1m40.0s

running (0m08.0s), 003/100 VUs, 21 complete and 0 interrupted iterations
spike   [   8% ] 003/100 VUs  0m08.0s/1m40.0s

running (0m09.0s), 004/100 VUs, 28 complete and 0 interrupted iterations
spike   [   9% ] 004/100 VUs  0m09.0s/1m40.0s

running (0m10.0s), 004/100 VUs, 35 complete and 0 interrupted iterations
spike   [  10% ] 004/100 VUs  0m10.0s/1m40.0s

running (0m11.0s), 005/100 VUs, 44 complete and 0 interrupted iterations
spike   [  11% ] 005/100 VUs  0m11.0s/1m40.0s

running (0m12.0s), 005/100 VUs, 54 complete and 0 interrupted iterations
spike   [  12% ] 005/100 VUs  0m12.0s/1m40.0s

running (0m13.0s), 005/100 VUs, 64 complete and 0 interrupted iterations
spike   [  13% ] 005/100 VUs  0m13.0s/1m40.0s

running (0m14.0s), 005/100 VUs, 74 complete and 0 interrupted iterations
spike   [  14% ] 005/100 VUs  0m14.0s/1m40.0s

running (0m15.0s), 005/100 VUs, 84 complete and 0 interrupted iterations
spike   [  15% ] 005/100 VUs  0m15.0s/1m40.0s

running (0m16.0s), 005/100 VUs, 93 complete and 0 interrupted iterations
spike   [  16% ] 005/100 VUs  0m16.0s/1m40.0s

running (0m17.0s), 005/100 VUs, 103 complete and 0 interrupted iterations
spike   [  17% ] 005/100 VUs  0m17.0s/1m40.0s

running (0m18.0s), 005/100 VUs, 112 complete and 0 interrupted iterations
spike   [  18% ] 005/100 VUs  0m18.0s/1m40.0s

running (0m19.0s), 005/100 VUs, 120 complete and 0 interrupted iterations
spike   [  19% ] 005/100 VUs  0m19.0s/1m40.0s

running (0m20.0s), 005/100 VUs, 130 complete and 0 interrupted iterations
spike   [  20% ] 005/100 VUs  0m20.0s/1m40.0s

running (0m21.0s), 014/100 VUs, 144 complete and 0 interrupted iterations
spike   [  21% ] 014/100 VUs  0m21.0s/1m40.0s

running (0m22.0s), 023/100 VUs, 174 complete and 0 interrupted iterations
spike   [  22% ] 023/100 VUs  0m22.0s/1m40.0s

running (0m23.0s), 033/100 VUs, 224 complete and 0 interrupted iterations
spike   [  23% ] 033/100 VUs  0m23.0s/1m40.0s

running (0m24.0s), 042/100 VUs, 291 complete and 0 interrupted iterations
spike   [  24% ] 042/100 VUs  0m24.0s/1m40.0s

running (0m25.0s), 052/100 VUs, 375 complete and 0 interrupted iterations
spike   [  25% ] 052/100 VUs  0m25.0s/1m40.0s

running (0m26.0s), 061/100 VUs, 479 complete and 0 interrupted iterations
spike   [  26% ] 061/100 VUs  0m26.0s/1m40.0s

running (0m27.0s), 071/100 VUs, 600 complete and 0 interrupted iterations
spike   [  27% ] 071/100 VUs  0m27.0s/1m40.0s

running (0m28.0s), 080/100 VUs, 736 complete and 0 interrupted iterations
spike   [  28% ] 080/100 VUs  0m28.0s/1m40.0s

running (0m29.0s), 090/100 VUs, 893 complete and 0 interrupted iterations
spike   [  29% ] 090/100 VUs  0m29.0s/1m40.0s

running (0m30.0s), 099/100 VUs, 1073 complete and 0 interrupted iterations
spike   [  30% ] 099/100 VUs  0m30.0s/1m40.0s

running (0m31.0s), 100/100 VUs, 1264 complete and 0 interrupted iterations
spike   [  31% ] 100/100 VUs  0m31.0s/1m40.0s

running (0m32.0s), 100/100 VUs, 1453 complete and 0 interrupted iterations
spike   [  32% ] 100/100 VUs  0m32.0s/1m40.0s

running (0m33.0s), 100/100 VUs, 1640 complete and 0 interrupted iterations
spike   [  33% ] 100/100 VUs  0m33.0s/1m40.0s

running (0m34.0s), 100/100 VUs, 1827 complete and 0 interrupted iterations
spike   [  34% ] 100/100 VUs  0m34.0s/1m40.0s

running (0m35.0s), 100/100 VUs, 2018 complete and 0 interrupted iterations
spike   [  35% ] 100/100 VUs  0m35.0s/1m40.0s

running (0m36.0s), 100/100 VUs, 2202 complete and 0 interrupted iterations
spike   [  36% ] 100/100 VUs  0m36.0s/1m40.0s

running (0m37.0s), 100/100 VUs, 2386 complete and 0 interrupted iterations
spike   [  37% ] 100/100 VUs  0m37.0s/1m40.0s

running (0m38.0s), 100/100 VUs, 2568 complete and 0 interrupted iterations
spike   [  38% ] 100/100 VUs  0m38.0s/1m40.0s

running (0m39.0s), 100/100 VUs, 2755 complete and 0 interrupted iterations
spike   [  39% ] 100/100 VUs  0m39.0s/1m40.0s

running (0m40.0s), 100/100 VUs, 2944 complete and 0 interrupted iterations
spike   [  40% ] 100/100 VUs  0m40.0s/1m40.0s

running (0m41.0s), 100/100 VUs, 3124 complete and 0 interrupted iterations
spike   [  41% ] 100/100 VUs  0m41.0s/1m40.0s

running (0m42.0s), 100/100 VUs, 3304 complete and 0 interrupted iterations
spike   [  42% ] 100/100 VUs  0m42.0s/1m40.0s

running (0m43.0s), 100/100 VUs, 3489 complete and 0 interrupted iterations
spike   [  43% ] 100/100 VUs  0m43.0s/1m40.0s

running (0m44.0s), 100/100 VUs, 3672 complete and 0 interrupted iterations
spike   [  44% ] 100/100 VUs  0m44.0s/1m40.0s

running (0m45.0s), 100/100 VUs, 3856 complete and 0 interrupted iterations
spike   [  45% ] 100/100 VUs  0m45.0s/1m40.0s

running (0m46.0s), 100/100 VUs, 4048 complete and 0 interrupted iterations
spike   [  46% ] 100/100 VUs  0m46.0s/1m40.0s

running (0m47.0s), 100/100 VUs, 4235 complete and 0 interrupted iterations
spike   [  47% ] 100/100 VUs  0m47.0s/1m40.0s

running (0m48.0s), 100/100 VUs, 4423 complete and 0 interrupted iterations
spike   [  48% ] 100/100 VUs  0m48.0s/1m40.0s

running (0m49.0s), 100/100 VUs, 4608 complete and 0 interrupted iterations
spike   [  49% ] 100/100 VUs  0m49.0s/1m40.0s

running (0m50.0s), 100/100 VUs, 4792 complete and 0 interrupted iterations
spike   [  50% ] 100/100 VUs  0m50.0s/1m40.0s

running (0m51.0s), 100/100 VUs, 4981 complete and 0 interrupted iterations
spike   [  51% ] 100/100 VUs  0m51.0s/1m40.0s

running (0m52.0s), 100/100 VUs, 5170 complete and 0 interrupted iterations
spike   [  52% ] 100/100 VUs  0m52.0s/1m40.0s

running (0m53.0s), 100/100 VUs, 5357 complete and 0 interrupted iterations
spike   [  53% ] 100/100 VUs  0m53.0s/1m40.0s

running (0m54.0s), 100/100 VUs, 5545 complete and 0 interrupted iterations
spike   [  54% ] 100/100 VUs  0m54.0s/1m40.0s

running (0m55.0s), 100/100 VUs, 5729 complete and 0 interrupted iterations
spike   [  55% ] 100/100 VUs  0m55.0s/1m40.0s

running (0m56.0s), 100/100 VUs, 5921 complete and 0 interrupted iterations
spike   [  56% ] 100/100 VUs  0m56.0s/1m40.0s

running (0m57.0s), 100/100 VUs, 6109 complete and 0 interrupted iterations
spike   [  57% ] 100/100 VUs  0m57.0s/1m40.0s

running (0m58.0s), 100/100 VUs, 6291 complete and 0 interrupted iterations
spike   [  58% ] 100/100 VUs  0m58.0s/1m40.0s

running (0m59.0s), 100/100 VUs, 6476 complete and 0 interrupted iterations
spike   [  59% ] 100/100 VUs  0m59.0s/1m40.0s

running (1m00.0s), 100/100 VUs, 6666 complete and 0 interrupted iterations
spike   [  60% ] 100/100 VUs  1m00.0s/1m40.0s

running (1m01.0s), 093/100 VUs, 6857 complete and 0 interrupted iterations
spike   [  61% ] 093/100 VUs  1m01.0s/1m40.0s

running (1m02.0s), 085/100 VUs, 7021 complete and 0 interrupted iterations
spike   [  62% ] 085/100 VUs  1m02.0s/1m40.0s

running (1m03.0s), 073/100 VUs, 7180 complete and 0 interrupted iterations
spike   [  63% ] 073/100 VUs  1m03.0s/1m40.0s

running (1m04.0s), 064/100 VUs, 7312 complete and 0 interrupted iterations
spike   [  64% ] 064/100 VUs  1m04.0s/1m40.0s

running (1m05.0s), 056/100 VUs, 7433 complete and 0 interrupted iterations
spike   [  65% ] 056/100 VUs  1m05.0s/1m40.0s

running (1m06.0s), 047/100 VUs, 7538 complete and 0 interrupted iterations
spike   [  66% ] 047/100 VUs  1m06.0s/1m40.0s

running (1m07.0s), 037/100 VUs, 7620 complete and 0 interrupted iterations
spike   [  67% ] 037/100 VUs  1m07.0s/1m40.0s

running (1m08.0s), 025/100 VUs, 7683 complete and 0 interrupted iterations
spike   [  68% ] 025/100 VUs  1m08.0s/1m40.0s

running (1m09.0s), 018/100 VUs, 7730 complete and 0 interrupted iterations
spike   [  69% ] 018/100 VUs  1m09.0s/1m40.0s

running (1m10.0s), 009/100 VUs, 7759 complete and 0 interrupted iterations
spike   [  70% ] 009/100 VUs  1m10.0s/1m40.0s

running (1m11.0s), 005/100 VUs, 7773 complete and 0 interrupted iterations
spike   [  71% ] 005/100 VUs  1m11.0s/1m40.0s

running (1m12.0s), 005/100 VUs, 7783 complete and 0 interrupted iterations
spike   [  72% ] 005/100 VUs  1m12.0s/1m40.0s

running (1m13.0s), 005/100 VUs, 7792 complete and 0 interrupted iterations
spike   [  73% ] 005/100 VUs  1m13.0s/1m40.0s

running (1m14.0s), 005/100 VUs, 7801 complete and 0 interrupted iterations
spike   [  74% ] 005/100 VUs  1m14.0s/1m40.0s

running (1m15.0s), 005/100 VUs, 7811 complete and 0 interrupted iterations
spike   [  75% ] 005/100 VUs  1m15.0s/1m40.0s

running (1m16.0s), 005/100 VUs, 7821 complete and 0 interrupted iterations
spike   [  76% ] 005/100 VUs  1m16.0s/1m40.0s

running (1m17.0s), 005/100 VUs, 7831 complete and 0 interrupted iterations
spike   [  77% ] 005/100 VUs  1m17.0s/1m40.0s

running (1m18.0s), 005/100 VUs, 7841 complete and 0 interrupted iterations
spike   [  78% ] 005/100 VUs  1m18.0s/1m40.0s

running (1m19.0s), 005/100 VUs, 7850 complete and 0 interrupted iterations
spike   [  79% ] 005/100 VUs  1m19.0s/1m40.0s

running (1m20.0s), 005/100 VUs, 7860 complete and 0 interrupted iterations
spike   [  80% ] 005/100 VUs  1m20.0s/1m40.0s

running (1m21.0s), 005/100 VUs, 7869 complete and 0 interrupted iterations
spike   [  81% ] 005/100 VUs  1m21.0s/1m40.0s

running (1m22.0s), 005/100 VUs, 7879 complete and 0 interrupted iterations
spike   [  82% ] 005/100 VUs  1m22.0s/1m40.0s

running (1m23.0s), 005/100 VUs, 7889 complete and 0 interrupted iterations
spike   [  83% ] 005/100 VUs  1m23.0s/1m40.0s

running (1m24.0s), 005/100 VUs, 7899 complete and 0 interrupted iterations
spike   [  84% ] 005/100 VUs  1m24.0s/1m40.0s

running (1m25.0s), 005/100 VUs, 7907 complete and 0 interrupted iterations
spike   [  85% ] 005/100 VUs  1m25.0s/1m40.0s

running (1m26.0s), 005/100 VUs, 7916 complete and 0 interrupted iterations
spike   [  86% ] 005/100 VUs  1m26.0s/1m40.0s

running (1m27.0s), 005/100 VUs, 7925 complete and 0 interrupted iterations
spike   [  87% ] 005/100 VUs  1m27.0s/1m40.0s

running (1m28.0s), 005/100 VUs, 7935 complete and 0 interrupted iterations
spike   [  88% ] 005/100 VUs  1m28.0s/1m40.0s

running (1m29.0s), 005/100 VUs, 7945 complete and 0 interrupted iterations
spike   [  89% ] 005/100 VUs  1m29.0s/1m40.0s

running (1m30.0s), 005/100 VUs, 7955 complete and 0 interrupted iterations
spike   [  90% ] 005/100 VUs  1m30.0s/1m40.0s

running (1m31.0s), 005/100 VUs, 7965 complete and 0 interrupted iterations
spike   [  91% ] 005/100 VUs  1m31.0s/1m40.0s

running (1m32.0s), 005/100 VUs, 7975 complete and 0 interrupted iterations
spike   [  92% ] 005/100 VUs  1m32.0s/1m40.0s

running (1m33.0s), 004/100 VUs, 7984 complete and 0 interrupted iterations
spike   [  93% ] 004/100 VUs  1m33.0s/1m40.0s

running (1m34.0s), 004/100 VUs, 7991 complete and 0 interrupted iterations
spike   [  94% ] 004/100 VUs  1m34.0s/1m40.0s

running (1m35.0s), 003/100 VUs, 7998 complete and 0 interrupted iterations
spike   [  95% ] 003/100 VUs  1m35.0s/1m40.0s

running (1m36.0s), 003/100 VUs, 8004 complete and 0 interrupted iterations
spike   [  96% ] 003/100 VUs  1m36.0s/1m40.0s

running (1m37.0s), 002/100 VUs, 8008 complete and 0 interrupted iterations
spike   [  97% ] 002/100 VUs  1m37.0s/1m40.0s

running (1m38.0s), 002/100 VUs, 8011 complete and 0 interrupted iterations
spike   [  98% ] 002/100 VUs  1m38.0s/1m40.0s

running (1m39.0s), 001/100 VUs, 8014 complete and 0 interrupted iterations
spike   [  99% ] 001/100 VUs  1m39.0s/1m40.0s

running (1m40.0s), 001/100 VUs, 8016 complete and 0 interrupted iterations
spike   [ 100% ] 001/100 VUs  1m40.0s/1m40.0s
time="2026-02-14T19:17:15+05:30" level=info msg="\n========== SPIKE TEST SUMMARY ==========" source=console
time="2026-02-14T19:17:15+05:30" level=info msg="Total requests: 8017" source=console
time="2026-02-14T19:17:15+05:30" level=info msg="Failed requests: 0" source=console
time="2026-02-14T19:17:15+05:30" level=info msg="Average response time: 27.72ms" source=console
time="2026-02-14T19:17:15+05:30" level=info msg="95th percentile: 44.48ms" source=console
time="2026-02-14T19:17:15+05:30" level=info msg="99th percentile: 479.95ms" source=console
time="2026-02-14T19:17:15+05:30" level=info msg="Max response time: 795.93ms" source=console
time="2026-02-14T19:17:15+05:30" level=info msg="==========================================\n" source=console
{
  "metrics": {
    "vus_max": {
      "type": "gauge",
      "contains": "default",
      "values": {
        "value": 100,
        "min": 100,
        "max": 100
      }
    },
    "http_req_blocked": {
      "contains": "time",
      "values": {
        "med": 0.009188,
        "max": 2.793175,
        "p(90)": 0.0168186,
        "p(95)": 0.02205,
        "p(99)": 0.39560916000000057,
        "avg": 0.020081926780591383,
        "min": 0.002448
      },
      "type": "trend"
    },
    "successful_requests": {
      "type": "counter",
      "contains": "default",
      "values": {
        "rate": 79.87585046549806,
        "count": 8017
      }
    },
    "http_req_connecting": {
      "type": "trend",
      "contains": "time",
      "values": {
        "avg": 0.00796337632530872,
        "min": 0,
        "med": 0,
        "max": 2.558065,
        "p(90)": 0,
        "p(95)": 0,
        "p(99)": 0.3054590400000028
      }
    },
    "http_req_sending": {
      "type": "trend",
      "contains": "time",
      "values": {
        "p(90)": 0.3362386000000001,
        "p(95)": 0.5282891999999997,
        "p(99)": 1.0937224000000036,
        "avg": 0.22394300261943315,
        "min": 0.019767,
        "med": 0.151533,
        "max": 15.576786
      }
    },
    "checks": {
      "type": "rate",
      "contains": "default",
      "values": {
        "passes": 16034,
        "fails": 0,
        "rate": 1
      }
    },
    "data_sent": {
      "type": "counter",
      "contains": "data",
      "values": {
        "rate": 5128355.908227073,
        "count": 514724151
      }
    },
    "iterations": {
      "type": "counter",
      "contains": "default",
      "values": {
        "rate": 79.87585046549806,
        "count": 8017
      }
    },
    "vus": {
      "contains": "default",
      "values": {
        "value": 1,
        "min": 0,
        "max": 100
      },
      "type": "gauge"
    },
    "http_reqs": {
      "type": "counter",
      "contains": "default",
      "values": {
        "count": 8017,
        "rate": 79.87585046549806
      }
    },
    "http_req_waiting": {
      "type": "trend",
      "contains": "time",
      "values": {
        "avg": 27.06811683260567,
        "min": 1.886366,
        "med": 5.644246,
        "max": 791.299677,
        "p(90)": 13.4183,
        "p(95)": 43.95286699999986,
        "p(99)": 475.0367576800003
      }
    },
    "data_received": {
      "type": "counter",
      "contains": "data",
      "values": {
        "rate": 12559217.854397735,
        "count": 1260546823
      }
    },
    "pdf_generation_time": {
      "type": "trend",
      "contains": "default",
      "values": {
        "avg": 27.949607084944493,
        "min": 2,
        "med": 6,
        "max": 797,
        "p(90)": 14,
        "p(95)": 45,
        "p(99)": 481.84000000000015
      }
    },
    "http_req_tls_handshaking": {
      "contains": "time",
      "values": {
        "avg": 0,
        "min": 0,
        "med": 0,
        "max": 0,
        "p(90)": 0,
        "p(95)": 0,
        "p(99)": 0
      },
      "type": "trend"
    },
    "http_req_receiving": {
      "type": "trend",
      "contains": "time",
      "values": {
        "med": 0.174568,
        "max": 37.031193,
        "p(90)": 0.41482100000000005,
        "p(95)": 1.2818801999999991,
        "p(99)": 5.693639680000007,
        "avg": 0.4254479612074342,
        "min": 0.032598
      }
    },
    "errors": {
      "contains": "default",
      "values": {
        "fails": 8017,
        "rate": 0,
        "passes": 0
      },
      "type": "rate"
    },
    "iteration_duration": {
      "values": {
        "min": 503.205878,
        "med": 507.74836,
        "max": 1454.085324,
        "p(90)": 516.697588,
        "p(95)": 547.7698785999997,
        "p(99)": 1075.60215192,
        "avg": 533.5414676940222
      },
      "type": "trend",
      "contains": "time"
    },
    "http_req_duration{expected_response:true}": {
      "type": "trend",
      "contains": "time",
      "values": {
        "p(90)": 14.053186800000004,
        "p(95)": 44.48372719999988,
        "p(99)": 479.95422568000015,
        "avg": 27.717507796432525,
        "min": 2.240976,
        "med": 6.038725,
        "max": 795.932942
      }
    },
    "http_req_duration": {
      "type": "trend",
      "contains": "time",
      "values": {
        "min": 2.240976,
        "med": 6.038725,
        "max": 795.932942,
        "p(90)": 14.053186800000004,
        "p(95)": 44.48372719999988,
        "p(99)": 479.95422568000015,
        "avg": 27.717507796432525
      },
      "thresholds": {
        "p(95)<10000": {
          "ok": true
        },
        "p(99)<15000": {
          "ok": true
        }
      }
    },
    "http_req_failed": {
      "type": "rate",
      "contains": "default",
      "values": {
        "rate": 0,
        "passes": 0,
        "fails": 8017
      },
      "thresholds": {
        "rate<0.3": {
          "ok": true
        }
      }
    }
  },
  "root_group": {
    "name": "",
    "path": "",
    "id": "d41d8cd98f00b204e9800998ecf8427e",
    "groups": [],
    "checks": [
        {
          "name": "status is 200",
          "path": "::status is 200",
          "id": "6210a8cd14cd70477eba5c5e4cb3fb5f",
          "passes": 8017,
          "fails": 0
        },
        {
          "name": "response has content",
          "path": "::response has content",
          "id": "4914ddff68a8948cdf0ed9d3223b4351",
          "passes": 8017,
          "fails": 0
        }
      ]
  },
  "options": {
    "noColor": false,
    "summaryTrendStats": [
      "avg",
      "min",
      "med",
      "max",
      "p(90)",
      "p(95)",
      "p(99)"
    ],
    "summaryTimeUnit": ""
  },
  "state": {
    "isStdOutTTY": false,
    "isStdErrTTY": false,
    "testRunDurationMs": 100368.258407
  }
}
running (1m40.4s), 000/100 VUs, 8017 complete and 0 interrupted iterations
spike ✓ [ 100% ] 000/100 VUs  1m40s
